{
  "conditions": [
    {
      "argv": [
        "diffeoforge",
        "modern-benchmark",
        "<verified-source-config>",
        "--subjects",
        "5",
        "--repeats",
        "5",
        "--warmups",
        "1",
        "--tile-autograd-strategy",
        "recompute",
        "--query-tile-size",
        "128",
        "--source-tile-size",
        "128",
        "--output",
        "conditions/condition-0001-subjects-000005-tiles-q000128-s000128-recompute"
      ],
      "cell_id": "subjects-000005-tiles-q000128-s000128",
      "condition_id": "condition-0001-subjects-000005-tiles-q000128-s000128-recompute",
      "effective_pairwise_evaluation": {
        "mode": "blockwise",
        "query_tile_size": 128,
        "source_tile_size": 128
      },
      "output_directory": "conditions/condition-0001-subjects-000005-tiles-q000128-s000128-recompute",
      "sequence": 1,
      "subject_count": 5,
      "tile_autograd_strategy": "recompute"
    },
    {
      "argv": [
        "diffeoforge",
        "modern-benchmark",
        "<verified-source-config>",
        "--subjects",
        "5",
        "--repeats",
        "5",
        "--warmups",
        "1",
        "--tile-autograd-strategy",
        "standard",
        "--query-tile-size",
        "128",
        "--source-tile-size",
        "128",
        "--output",
        "conditions/condition-0002-subjects-000005-tiles-q000128-s000128-standard"
      ],
      "cell_id": "subjects-000005-tiles-q000128-s000128",
      "condition_id": "condition-0002-subjects-000005-tiles-q000128-s000128-standard",
      "effective_pairwise_evaluation": {
        "mode": "blockwise",
        "query_tile_size": 128,
        "source_tile_size": 128
      },
      "output_directory": "conditions/condition-0002-subjects-000005-tiles-q000128-s000128-standard",
      "sequence": 2,
      "subject_count": 5,
      "tile_autograd_strategy": "standard"
    },
    {
      "argv": [
        "diffeoforge",
        "modern-benchmark",
        "<verified-source-config>",
        "--subjects",
        "5",
        "--repeats",
        "5",
        "--warmups",
        "1",
        "--tile-autograd-strategy",
        "recompute",
        "--query-tile-size",
        "32",
        "--source-tile-size",
        "32",
        "--output",
        "conditions/condition-0003-subjects-000005-tiles-q000032-s000032-recompute"
      ],
      "cell_id": "subjects-000005-tiles-q000032-s000032",
      "condition_id": "condition-0003-subjects-000005-tiles-q000032-s000032-recompute",
      "effective_pairwise_evaluation": {
        "mode": "blockwise",
        "query_tile_size": 32,
        "source_tile_size": 32
      },
      "output_directory": "conditions/condition-0003-subjects-000005-tiles-q000032-s000032-recompute",
      "sequence": 3,
      "subject_count": 5,
      "tile_autograd_strategy": "recompute"
    },
    {
      "argv": [
        "diffeoforge",
        "modern-benchmark",
        "<verified-source-config>",
        "--subjects",
        "5",
        "--repeats",
        "5",
        "--warmups",
        "1",
        "--tile-autograd-strategy",
        "standard",
        "--query-tile-size",
        "32",
        "--source-tile-size",
        "32",
        "--output",
        "conditions/condition-0004-subjects-000005-tiles-q000032-s000032-standard"
      ],
      "cell_id": "subjects-000005-tiles-q000032-s000032",
      "condition_id": "condition-0004-subjects-000005-tiles-q000032-s000032-standard",
      "effective_pairwise_evaluation": {
        "mode": "blockwise",
        "query_tile_size": 32,
        "source_tile_size": 32
      },
      "output_directory": "conditions/condition-0004-subjects-000005-tiles-q000032-s000032-standard",
      "sequence": 4,
      "subject_count": 5,
      "tile_autograd_strategy": "standard"
    },
    {
      "argv": [
        "diffeoforge",
        "modern-benchmark",
        "<verified-source-config>",
        "--subjects",
        "3",
        "--repeats",
        "5",
        "--warmups",
        "1",
        "--tile-autograd-strategy",
        "standard",
        "--query-tile-size",
        "32",
        "--source-tile-size",
        "32",
        "--output",
        "conditions/condition-0005-subjects-000003-tiles-q000032-s000032-standard"
      ],
      "cell_id": "subjects-000003-tiles-q000032-s000032",
      "condition_id": "condition-0005-subjects-000003-tiles-q000032-s000032-standard",
      "effective_pairwise_evaluation": {
        "mode": "blockwise",
        "query_tile_size": 32,
        "source_tile_size": 32
      },
      "output_directory": "conditions/condition-0005-subjects-000003-tiles-q000032-s000032-standard",
      "sequence": 5,
      "subject_count": 3,
      "tile_autograd_strategy": "standard"
    },
    {
      "argv": [
        "diffeoforge",
        "modern-benchmark",
        "<verified-source-config>",
        "--subjects",
        "3",
        "--repeats",
        "5",
        "--warmups",
        "1",
        "--tile-autograd-strategy",
        "recompute",
        "--query-tile-size",
        "32",
        "--source-tile-size",
        "32",
        "--output",
        "conditions/condition-0006-subjects-000003-tiles-q000032-s000032-recompute"
      ],
      "cell_id": "subjects-000003-tiles-q000032-s000032",
      "condition_id": "condition-0006-subjects-000003-tiles-q000032-s000032-recompute",
      "effective_pairwise_evaluation": {
        "mode": "blockwise",
        "query_tile_size": 32,
        "source_tile_size": 32
      },
      "output_directory": "conditions/condition-0006-subjects-000003-tiles-q000032-s000032-recompute",
      "sequence": 6,
      "subject_count": 3,
      "tile_autograd_strategy": "recompute"
    },
    {
      "argv": [
        "diffeoforge",
        "modern-benchmark",
        "<verified-source-config>",
        "--subjects",
        "5",
        "--repeats",
        "5",
        "--warmups",
        "1",
        "--tile-autograd-strategy",
        "standard",
        "--query-tile-size",
        "64",
        "--source-tile-size",
        "64",
        "--output",
        "conditions/condition-0007-subjects-000005-tiles-q000064-s000064-standard"
      ],
      "cell_id": "subjects-000005-tiles-q000064-s000064",
      "condition_id": "condition-0007-subjects-000005-tiles-q000064-s000064-standard",
      "effective_pairwise_evaluation": {
        "mode": "blockwise",
        "query_tile_size": 64,
        "source_tile_size": 64
      },
      "output_directory": "conditions/condition-0007-subjects-000005-tiles-q000064-s000064-standard",
      "sequence": 7,
      "subject_count": 5,
      "tile_autograd_strategy": "standard"
    },
    {
      "argv": [
        "diffeoforge",
        "modern-benchmark",
        "<verified-source-config>",
        "--subjects",
        "5",
        "--repeats",
        "5",
        "--warmups",
        "1",
        "--tile-autograd-strategy",
        "recompute",
        "--query-tile-size",
        "64",
        "--source-tile-size",
        "64",
        "--output",
        "conditions/condition-0008-subjects-000005-tiles-q000064-s000064-recompute"
      ],
      "cell_id": "subjects-000005-tiles-q000064-s000064",
      "condition_id": "condition-0008-subjects-000005-tiles-q000064-s000064-recompute",
      "effective_pairwise_evaluation": {
        "mode": "blockwise",
        "query_tile_size": 64,
        "source_tile_size": 64
      },
      "output_directory": "conditions/condition-0008-subjects-000005-tiles-q000064-s000064-recompute",
      "sequence": 8,
      "subject_count": 5,
      "tile_autograd_strategy": "recompute"
    },
    {
      "argv": [
        "diffeoforge",
        "modern-benchmark",
        "<verified-source-config>",
        "--subjects",
        "1",
        "--repeats",
        "5",
        "--warmups",
        "1",
        "--tile-autograd-strategy",
        "standard",
        "--query-tile-size",
        "128",
        "--source-tile-size",
        "128",
        "--output",
        "conditions/condition-0009-subjects-000001-tiles-q000128-s000128-standard"
      ],
      "cell_id": "subjects-000001-tiles-q000128-s000128",
      "condition_id": "condition-0009-subjects-000001-tiles-q000128-s000128-standard",
      "effective_pairwise_evaluation": {
        "mode": "blockwise",
        "query_tile_size": 128,
        "source_tile_size": 128
      },
      "output_directory": "conditions/condition-0009-subjects-000001-tiles-q000128-s000128-standard",
      "sequence": 9,
      "subject_count": 1,
      "tile_autograd_strategy": "standard"
    },
    {
      "argv": [
        "diffeoforge",
        "modern-benchmark",
        "<verified-source-config>",
        "--subjects",
        "1",
        "--repeats",
        "5",
        "--warmups",
        "1",
        "--tile-autograd-strategy",
        "recompute",
        "--query-tile-size",
        "128",
        "--source-tile-size",
        "128",
        "--output",
        "conditions/condition-0010-subjects-000001-tiles-q000128-s000128-recompute"
      ],
      "cell_id": "subjects-000001-tiles-q000128-s000128",
      "condition_id": "condition-0010-subjects-000001-tiles-q000128-s000128-recompute",
      "effective_pairwise_evaluation": {
        "mode": "blockwise",
        "query_tile_size": 128,
        "source_tile_size": 128
      },
      "output_directory": "conditions/condition-0010-subjects-000001-tiles-q000128-s000128-recompute",
      "sequence": 10,
      "subject_count": 1,
      "tile_autograd_strategy": "recompute"
    },
    {
      "argv": [
        "diffeoforge",
        "modern-benchmark",
        "<verified-source-config>",
        "--subjects",
        "1",
        "--repeats",
        "5",
        "--warmups",
        "1",
        "--tile-autograd-strategy",
        "standard",
        "--query-tile-size",
        "64",
        "--source-tile-size",
        "64",
        "--output",